{
  "$schema": "http://json-schema.org/draft-07/schema#",
  "type": "object",
  "required": ["intent", "files", "commands", "evidence", "hitl", "unknowns"],
  "properties": {
    "intent": { "type": "string" },
    "files": { "type": "array", "items": { "type": "string" } },
    "commands": { "type": "array", "items": { "type": "string" } },
    "evidence": { "type": "array", "items": { "type": "string" } },
    "hitl": { "type": "array", "items": { "type": "string" } },
    "unknowns": { "type": "array", "items": { "type": "string" } }
  }
}
